{
  "$schema": "https://json-schema.org/draft/2020-12/schema",
  "$id": "https://schemas.rippleguard.dev/domain/evaluation-run.schema.json",
  "title": "Evaluation Run",
  "description": "Immutable evaluation attempt. Recalculation creates a new evaluationRunId and may point to the previous run with supersedesRunId; an existing result is never overwritten.",
  "type": "object",
  "properties": {
    "evaluationRunId": { "type": "string", "format": "uuid" },
    "decisionCaseId": { "type": "string", "minLength": 1 },
    "inputSnapshotVersion": { "type": "string", "minLength": 1 },
    "executionPlanVersion": { "type": "string", "minLength": 1 },
    "status": { "type": "string", "description": "CREATED has fixed inputs; RUNNING is executing; COMPLETED produced results; BLOCKED hit a hard block; FAILED had a technical or contract failure; CANCELLED stopped safely. Terminal runs are never reopened.", "enum": ["CREATED", "RUNNING", "COMPLETED", "BLOCKED", "FAILED", "CANCELLED"] },
    "supersedesRunId": { "type": ["string", "null"], "format": "uuid" },
    "createdAt": { "type": "string", "format": "date-time", "pattern": "T.*(?:Z|[+-][0-9]{2}:[0-9]{2})$" }
  },
  "required": ["evaluationRunId", "decisionCaseId", "inputSnapshotVersion", "executionPlanVersion", "status", "supersedesRunId", "createdAt"],
  "additionalProperties": false
}
